{
  "contract_version": "0.1.0",
  "id": "cs.skills.threat-intelligence.normalize-iocs",
  "name": "normalize-iocs",
  "version": "0.1.0",
  "description": "Normalize and deduplicate supplied IPv4, IPv6, ASCII domain and SHA-256 indicators, preserving source references. Use before offline triage; no reputation lookup, DNS resolution or external enrichment is performed.",
  "category": "threat-intelligence",
  "domain": "cybersecurity",
  "inputs": {
    "schema": "input.schema.json",
    "max_bytes": 262144
  },
  "outputs": {
    "schema": "output.schema.json",
    "max_bytes": 262144
  },
  "dependencies": [],
  "required_tools": [],
  "permissions": {
    "capabilities": [
      "READ",
      "ANALYZE",
      "GENERATE"
    ],
    "network": {
      "enabled": false,
      "hosts": []
    },
    "filesystem": {
      "read": [],
      "write": []
    },
    "shell": false,
    "privilege_escalation": false,
    "environment": [],
    "external_services": []
  },
  "side_effects": [],
  "safety": {
    "classification": "passive-analysis",
    "destructive": false,
    "authorization_policy": "none-no-side-effects",
    "secret_handling": "reject"
  },
  "execution": {
    "kind": "builtin",
    "entrypoint": "cs.skills.threat-intelligence.normalize-iocs",
    "determinism": "deterministic",
    "ai": {
      "required": false,
      "providers": []
    },
    "source_content_execution": false
  },
  "provenance": [
    {
      "uri": "https://docs.python.org/3/library/ipaddress.html",
      "title": "Primary technical/design reference (no material imported)",
      "relationship": "technical-reference",
      "reviewed_at": "2026-09-05"
    }
  ],
  "supported_platforms": [
    "linux",
    "windows",
    "macos"
  ],
  "examples": [
    {
      "input": "examples/input.json",
      "expected": "examples/expected.json"
    }
  ],
  "tests": [
    "tests/test_normalize_iocs.py"
  ],
  "maintainers": [
    "cyber-sentinel"
  ],
  "status": "experimental",
  "license_status": "approved",
  "license": "Apache-2.0"
}
